{
  "kind": "uwmd-document-signature",
  "signature_version": "1",
  "subject": {
    "representation": "uwx-markdown",
    "representation_version": "1.0",
    "canonicalization": "uw-envelope-semantic",
    "canonicalization_version": "1.0",
    "digest": "sha256:8580582b594d5d472de8339e36eab8222c8614ba911defbdd6309eb38e4402f1"
  },
  "alg": "ed25519",
  "kid": "uwmd-conformance-ed25519",
  "signed_at": "2026-10-14T00:00:00Z",
  "sig": "HB2EoI3wETa7_az7Mu6YKzNwRXzr3D92RylVEjZUxSgXRWikKycQ4HVH57JTO0zSLCWZ3c4P9axPWBzGDxcwBw="
}
